{
  "$schema": "../../../schema/dojo.schema.json",
  "id": "db-relalg",
  "subject": "db",
  "title": "Relational algebra",
  "procedure": "Writing queries in relational algebra",
  "description": "Translate a question in plain language into an algebra expression.",
  "levels": ["easy", "medium", "exam"],
  "topics": ["relational-algebra"],
  "promptTemplate": "Give a schema with 2–3 relations and a question. easy: selection and projection. medium: join and renaming. exam: difference or division. Notation: σ, π, ⋈, ρ, ∪, −, ÷ (ASCII stand-ins sigma, pi, join, rho, union, minus, div are fine). When checking: operator by operator from the inside out, checking attribute names and the schemas of intermediate results.",
  "answerFormat": "One expression, intermediate steps welcome."
}
