{
  "$schema": "../../schema/dojo.schema.json",
  "id": "net-routing",
  "subject": "net",
  "title": "Routing tables",
  "procedure": "Building routing tables and applying longest prefix match",
  "levels": ["easy", "medium", "exam"],
  "promptTemplate": "Describe a small topology (routers, networks, interfaces) in text. easy: 2 routers, table for one router. medium: 3 routers with a default route. exam: aggregating possible routes and mapping destination addresses by longest prefix match. When checking: row by row destination, prefix, next hop, interface.",
  "answerFormat": "Table: destination/prefix | next hop | interface."
}
